<?xml version="1.0" encoding="UTF-8" standalone="no"?>
<scenario xmlns:xsi="http://www.w3.org/2001/XMLSchema-instance" analysisNo="0" name="examples of some interventions on 1-day TS" schemaVersion="26" wuID="0" xsi:noNamespaceSchemaLocation="scenario.xsd">
  <demography maximumAgeYrs="90" name="test" popSize="100">
    <ageGroup lowerbound="0">
      <group poppercent="3.474714994" upperbound="1"/>
      <group poppercent="12.76004028" upperbound="5"/>
      <group poppercent="14.52151394" upperbound="10"/>
      <group poppercent="12.75565434" upperbound="15"/>
      <group poppercent="10.83632374" upperbound="20"/>
      <group poppercent="8.393312454" upperbound="25"/>
      <group poppercent="7.001421452" upperbound="30"/>
      <group poppercent="5.800587654" upperbound="35"/>
      <group poppercent="5.102136612" upperbound="40"/>
      <group poppercent="4.182561874" upperbound="45"/>
      <group poppercent="3.339409351" upperbound="50"/>
      <group poppercent="2.986112356" upperbound="55"/>
      <group poppercent="2.555766582" upperbound="60"/>
      <group poppercent="2.332763433" upperbound="65"/>
      <group poppercent="1.77400255" upperbound="70"/>
      <group poppercent="1.008525491" upperbound="75"/>
      <group poppercent="0.74167341" upperbound="80"/>
      <group poppercent="0.271863401" upperbound="85"/>
      <group poppercent="0.161614642" upperbound="90"/>
    </ageGroup>
  </demography>
  <monitoring name="Test Moni"/>
  <interventions name="No interventions">
    <descriptions/>
  </interventions>
  <healthSystem/>
  <entoData mode="4" name="Namawala, single vector">
    <vector>
      <anopheles mosquito="arabiensis" propInfected="0.078" propInfectious="0.021">
        <eir EIRRotateAngle="0" a0="-3.251" a1="0.8968" a2="-0.4551" b1="2.678" b2="2.599"/>
        <mosq extrinsicIncubationPeriod="11" minInfectedThreshold="0.1" mosqHumanBloodIndex="1.0" mosqLaidEggsSameDayProportion="0.313" mosqProbBiting="0.95" mosqProbFindRestSite="0.95" mosqProbOvipositing="0.88" mosqProbResting="0.99" mosqRestDuration="3" mosqSeekingDuration="0.33" mosqSurvivalFeedingCycleProbability="0.623"/>
      </anopheles>
    </vector>
  </entoData>
  <model/>
</scenario>
